,contentId,If you liked,Recommendation 1,Recommendation 2,Recommendation 3,Recommendation 4,Recommendation 5
210,4911701623098526999,Why image recognition is about to transform business,Mobile marketing statistics 2016,The barbell effect of machine learning.,Google Cloud Goes to the Farm,Google acquires deep search engine Kifi to enhance its Spaces group chat app,Nespresso
211,-2747266787901704910,Bayer propõe comprar Monsanto para formar a maior agroquímica do mundo,"Carne artificial acabará com o agronegócio brasileiro, afirma especialista",Programa de Demissão Voluntária na Moto Honda tem mais de 500 adesões,Agronegócio mantém crescimento com tecnologia - inova.jor,Will blockchain drive the fourth Industrial Revolution?,Este texto do Ranieri é a melhor coisa que você lerá hoje
212,8483892789913825147,Cookbook,"AWS vs Packet.net Why we left AWS Benchmarking AWS's Network, Disk, and CPU Performance - Tiingo Thoughts",Ordering coffee in Italy: the 10 commandments,Joel on Software,WWDC 2016 preview: How to watch &amp; what to expect at Apple's event on Monday,What to Expect at WWDC 2016
213,2817960273225808857,Johnson & Johnson compra líder global em dermocosméticos | EXAME.com,Johnson & Johnson comprará grupo suíço por US$ 30 bi,Este site quer conectar profissionais trans e travestis a empresas que não têm preconceito,7 Questions to Ask Before Your Next Digital Transformation,Para entender o Dia Internacional contra a Homofobia,Who sponsors Drupal development? | Dries Buytaert
214,-4875060556471576861,Jenkins 2.0 is here!,"GitHub broke my 1,000 day streak - Free Code Camp",Announcing SyntaxNet: The World's Most Accurate Parser Goes Open Source,My experience with Google's Associate Android Developer Certification,Why Learning Angular 2 Was Excruciating,Why Kubernetes may be a bigger threat to Amazon than Google's cloud - TechRepublic
215,8589361101754366293,Acesse a versão Material Design do YouTube | Google Discovery,How I sped up the initial render of my Polymer app by 86%,"HoloLens, da Microsoft, engana o usuário para consertar conexões falhas do cérebro",Aplicação de visão computacional com OpenCV,WebAssembly Browser Preview,Google lança experimentos com inteligência artificial | Google Discovery
216,4069333494579100211,"Agile is Dead, Long Live Continuous Delivery - Gradle",Do you want Crappy Agile?,VersionOne AgilelIVE™ Webinar Series| SAFe® Expert Webinar,An operating model for company-wide agile development,Dicas avançadas de ruby (capybara/cucumber),"Por dentro do Nubank, conheça os segredos da fintech mais festejada do país"
217,-4974757204495953627,Alecrim/AlecrimCoreData,Ordering coffee in Italy: the 10 commandments,"AWS vs Packet.net Why we left AWS Benchmarking AWS's Network, Disk, and CPU Performance - Tiingo Thoughts",Joel on Software,WWDC 2016 preview: How to watch &amp; what to expect at Apple's event on Monday,What to Expect at WWDC 2016
218,4369833742675497700,Transforming life insurance with design thinking,O tênue equilíbrio da equipe que desenha produtos digitais,Chatbots: Are they better without the chat?,Running GV sprints inside corporates - learn from my mistakes - Sprint Stories,Embracing Agile,Campus São Paulo: conheça a primeira turma do Programa de Residentes
219,-8340365043226490059,big data = real time,Why the customer experience matters,Qual é a real diferença entre Data Storytelling e análise de dados? - CIO,Organizing for digital acceleration: Making a two-speed IT operating model work,Design Sprint: onde o design e a velocidade importam,A saga do jovem CEO da Dasa
220,-7539387928750597096,Smart Contact Lens-Eyeglass Combo Could Monitors Diabetes and Delivers Drugs,Gartner Reprint,One Dollar Board: Um projeto brasileiro para revolucionar a educação,Gartner Reprint,Comparing IoT Platforms: Compare 4 IoT platform for IoT projects,Top Asset Tracking Software: The 52 Best Tools and Software Solutions to Track Your Company's Vital Physical Assets
221,-986193709330758766,System Code Geeks are giving away a FREE Sublime Text Editor License,Sam Newman - Backends For Frontends,Firebase Test Lab for Android,Vision API - Image Content Analysis,What Color is Your Function?,Post: Just Say mNo to Hungarian Notation
222,-4050006690189978332,Announcing SyntaxNet: The World's Most Accurate Parser Goes Open Source,Transfer Style But Not Color,Google's Cloud Machine Learning service is now in public beta,Google lags behind Amazon and Microsoft's cloud in one important area,Scala is the new golden child,"Telecoms open shop on Madison Avenue, but will brands buy?"
223,-8085935119790093311,Graph Capabilities with the Elastic Stack,Google's Cloud Machine Learning service is now in public beta,Machine Learning Is No Longer Just for Experts,Algorithms and architecture for job recommendations,How Mark Zuckerberg Led Facebook's War to Crush Google Plus,Scala is the new golden child
224,4814419120794996930,"Netflix says Geography, Age, and Gender are ""Garbage"" for Predicting Taste",Google researchers teach AIs to see the important parts of images - and tell you about them,Using behavioral data to improve customer satisfaction,Why Netflix thinks its personalized recommendation engine is worth $1 billion per year,Machine Learning Is At The Very Peak Of Its Hype Cycle - ARC,"DARPA Goes ""Meta"" with Machine Learning for Machine Learning"
225,3608243634452078989,"Carne artificial acabará com o agronegócio brasileiro, afirma especialista",Bayer propõe comprar Monsanto para formar a maior agroquímica do mundo,Programa de Demissão Voluntária na Moto Honda tem mais de 500 adesões,Agronegócio mantém crescimento com tecnologia - inova.jor,Especial Agrishow: Soluções de agricultura de precisão elevam produtividade e aumentam a qualidade do plantio,Este texto do Ranieri é a melhor coisa que você lerá hoje
226,-1101832997669013246,Visa Introduces NFC-Enabled Payment Ring for Team Visa Sponsored Athletes to Use at Rio 2016 Olympic Games,Brazil's Bank Itaú Joins R3 Blockchain Consortium - CoinDesk,#FinTech is all about human-centred design - Chris Skinner's blog,Itaú é pioneiro do blockchain,The End Of Apps As We Know Them - Inside Intercom,"Elopar lança o ""Digio"", cartão para brigar com Nubank"
227,-8189315446782327370,WWDC 2016 preview: How to watch &amp; what to expect at Apple's event on Monday,Ordering coffee in Italy: the 10 commandments,"AWS vs Packet.net Why we left AWS Benchmarking AWS's Network, Disk, and CPU Performance - Tiingo Thoughts",Joel on Software,What to Expect at WWDC 2016,"The New App Store: Subscription Pricing, Faster Approvals, and Search Ads"
228,7459726589306441015,Shopping app Spring's redesign could be a game-changer,Making open source data more available,"No, Apple isn't the next BlackBerry - it's the next Microsoft",Here's proof that Google is getting serious about battling Facebook in a key area,"Deep-learning algorithm predicts photos' memorability at ""near-human"" levels","Facebook Workplace officially launches on the web and iOS, set to compete head-on with Slack"
229,2589533162305407436,6 reasons why I like KeystoneML,"Feather: A Fast On-Disk Format for Data Frames for R and Python, powered by Apache Arrow",Machine Learning Is No Longer Just for Experts,Google's Cloud Machine Learning service is now in public beta,Algorithms and architecture for job recommendations,How Netflix does A/B Testing - uxdesign.cc - User Experience Design
230,-655909700262679295,Banco desafia empreendedores e estudantes de tecnologia a buscarem inovação para processos | EXAME.com,Visa lança desafio para startups de tecnologia - Startupi,Design Kit: Prototyping,The Drive to Bank on Digital,Novas frentes de trabalho da Alelo vão de ações de fidelidade a novos meios de pagamento,"Elopar lança o ""Digio"", cartão para brigar com Nubank"
231,1024145536490998555,Porto Seguro compra carteira de seguros Auto da Chubb,Jeff Seguros: SEGUROS E GAMES,Ranking das maiores seguradoras da Europa - 2015 | Sonho Seguro,Transforming life insurance with design thinking,Liberty vai adotar telemetria e baratear seguro para bons motoristas,BDD Best Practices and Guidelines - Testing Excellence
232,-3170783292462058942,Não existe frete grátis!,Mercado de Cosméticos no Brasil - Setor que não conhece crise!,From E-Commerce to Web 3.0: Let the Bots Do the Shopping,Vendas da Netshoes crescem 267% em dispositivos móveis no 1º semestre - 24Brasil,Four Node.js Gotchas that Operations Teams Should Know about - The New Stack,"Why Performance Matters, Part 1: The Perception Of Time - Smashing Magazine"
233,-8370744479086515302,Mobile banking conquista o coração dos brasileiros,CMN regulamenta abertura de conta de depósito por meio eletrônico,Nubank começa a testar seu programa de fidelidade - Empresas Tech,"Say goodbye to traditional customer segmentation "" Banking Technology",Cade autoriza Itaú Unibanco e Mastercard a criarem nova bandeira de cartão,Bradesco e Visa anunciam pulseira que substitui cartão | EXAME.com
234,-3161714324304758767,"Deep-learning algorithm predicts photos' memorability at ""near-human"" levels","Facebook Workplace officially launches on the web and iOS, set to compete head-on with Slack",Staying one step ahead at Pixar: An interview with Ed Catmull,The return of the machinery question,Lilly Wachowski Makes First Public Appearance Since Coming Out as Transgender,Artificial intelligence is changing SEO faster than you think
235,-42126282997118624,Programa de Demissão Voluntária na Moto Honda tem mais de 500 adesões,"Carne artificial acabará com o agronegócio brasileiro, afirma especialista",Bayer propõe comprar Monsanto para formar a maior agroquímica do mundo,Agronegócio mantém crescimento com tecnologia - inova.jor,Este texto do Ranieri é a melhor coisa que você lerá hoje,Will blockchain drive the fourth Industrial Revolution?
236,-1313614305945895108,Ordering coffee in Italy: the 10 commandments,"AWS vs Packet.net Why we left AWS Benchmarking AWS's Network, Disk, and CPU Performance - Tiingo Thoughts",Joel on Software,WWDC 2016 preview: How to watch &amp; what to expect at Apple's event on Monday,What to Expect at WWDC 2016,"The New App Store: Subscription Pricing, Faster Approvals, and Search Ads"
237,-5778988730475305016,Artificial intelligence is changing SEO faster than you think,"Deep-learning algorithm predicts photos' memorability at ""near-human"" levels",The return of the machinery question,"Amazon open-sources its own deep learning software, DSSTNE",The barbell effect of machine learning.,How Mark Zuckerberg Led Facebook's War to Crush Google Plus
238,7414483722019578252,Good developers take breaks * Greetings Programs,Conheça 20 atletas LGBT que vão competir nas Olimpíadas do Rio,"Little girls doubt that women can be brilliant, study shows",Este site quer conectar profissionais trans e travestis a empresas que não têm preconceito,Introducing Ask a Female Engineer,The Genderbread Person v3 | It's Pronounced Metrosexual
239,-6778286518036232293,The Future of Business is Design,A digital crack in banking's business model,"Microsoft adquire LinkedIn por US$ 26,2 bilhões",The End Of Apps As We Know Them - Inside Intercom,Staying one step ahead at Pixar: An interview with Ed Catmull,Embracing Agile
240,1318981494172475806,"Google acquires Synergyse, an interactive training service for Google Apps","Google launches Springboard, an AI-powered assistant for its enterprise customers","Hello, a nova rede social do Orkut, está liberada no Brasil",Building more accessible technology,"Bots, Messenger and the future of customer service",The AI business landscape
241,-1630229587164086350,Dries Buytaert,Lightning Distribution for Drupal: Build Advanced Authoring Experiences in Drupal 8,The Death of Drupal Commerce as an Ecommerce Solution - Third & Grove,Johnson & Johnson comprará grupo suíço por US$ 30 bi,Meet Aquifer: A build system for easier Drupal development,Acquia Engage Awards Finalists Announced
242,-4798431998955209742,What Color is Your Function?,"Apple File System (APFS) announced for 2017, scales 'from Apple Watch to Mac Pro' and focuses on encryption",You don't talk about refactoring club,Alecrim/AlecrimCoreData,Tech in Brazil is booming despite the country's political troubles,"The New App Store: Subscription Pricing, Faster Approvals, and Search Ads"
243,-4333056764244640444,Lentes de contato inteligentes serão o wearable definitivo,Decentralizing IoT networks through blockchain,Peças Translúcidas,Introducing New Relic Infrastructure,Smart Contact Lens-Eyeglass Combo Could Monitors Diabetes and Delivers Drugs,Ray Kurzweil: The world isn't getting worse - our information is getting better
244,7818691400791322406,Nubank e Goldman fecham parceria de R$ 200 milhões,Abrimos uma conta no Original.,"Salesforce buys Demandware for $2.8B, taking a big step into e-commerce",Bradesco lança serviço inédito para estimular o hábito de poupar,CMN regulamenta abertura de conta de depósito por meio eletrônico,Novas frentes de trabalho da Alelo vão de ações de fidelidade a novos meios de pagamento
245,6852597772196653540,Firebase and Google Cloud: better together,Google lags behind Amazon and Microsoft's cloud in one important area,How the queen of Silicon Valley is helping Google go after Amazon's most profitable business,VMware Cloud™ on AWS - A Closer Look - frankdenneman.nl,Google Cloud Platform's preemptible VMs are now up to 33% cheaper,"Tabs vs Spaces: How They Write Java at Google, Twitter, Mozilla and Pied Piper | Takipi Blog"
246,5424502143558028097,Sam Newman - Backends For Frontends,Post: Just Say mNo to Hungarian Notation,Firebase Test Lab for Android,The Importance of Code Reviews,Dark Scrum,Up your app's sharing game with DirectShare - Google Developers
247,4195778828921942020,The five phases of migrating to Google Cloud Platform,"Google Cloud Platform icons and sample architectural diagrams, for your designing pleasure",Leveling Up Your JavaScript -,The Java 8 API Design Principles,CSS Containment in Chrome 52 | Web Updates - Google Developers,Docker 1.12: Now with Built-in Orchestration!
248,-541666025693385823,Calm down: Google's use of Material Design on iOS is fine,Alecrim/AlecrimCoreData,"The New App Store: Subscription Pricing, Faster Approvals, and Search Ads",WWDC 2016 preview: How to watch &amp; what to expect at Apple's event on Monday,Ordering coffee in Italy: the 10 commandments,Joel on Software
249,-8404657131309965885,Visa vai testar nas Olimpíadas do Rio um anel para pagamentos,Inbox by Gmail ganha formatação de texto | Google Discovery,Como a Microsoft está trabalhando com o conceito de IoT - Startupi,Par de alianças impede que seu parceiro assista Netflix sem você,"No, Apple isn't the next BlackBerry - it's the next Microsoft",Making open source data more available
250,5238119115012015307,Embracing Agile,An operating model for company-wide agile development,Staying one step ahead at Pixar: An interview with Ed Catmull,Big IT Rising,An operating model for company-wide agile development,Rewiring Citi for the digital age
251,8835339470389644264,Aplicativos do Android agora podem reagir com o ambiente | Google Discovery,Comparing IoT Platforms: Compare 4 IoT platform for IoT projects,"Google lança Science Journal, aplicativo de ciências para Android | Google Discovery",Firebase Test Lab for Android,The Developer's Midlife Crisis: What's Next?,Sam Newman - Backends For Frontends
252,-6484638837208285334,"5 awesome Google Keep features you aren't using, but should be",The AI business landscape,"Google lança Science Journal, aplicativo de ciências para Android | Google Discovery",Why the customer experience matters,"Secret's founder returns with Bold, a Medium for enterprise","Amazon open-sources its own deep learning software, DSSTNE"
253,8651615486877503655,Java 8 Best Practices Cheat Sheet,Microservices - When to React Vs. Orchestrate - Capital One DevExchange,Notes on Reactive Programming Part I: The Reactive Landscape,Communication patterns in a Microservice world,One weird trick that will change the way you code forever: JavaScript TDD,Java 8 Streams - A Deeper Approach About Performance Improvement
254,-1622037268576555626,You won't recognize the new world of digital payments without this report,Nubank pode fechar as portas se BC confirmar mudança amanhã,Accenture amplia atuação no Brasil,Piloto de caça criado por inteligência artificial vence humano em combate simulado,Visa lança desafio para startups de tecnologia - Startupi,Bradesco vai lançar novo banco digital: o Next.
255,-4233177915193302509,Governo brasileiro cria manual para contratação de cloud,"No, Apple isn't the next BlackBerry - it's the next Microsoft",Two Different Sales Motions . . . .,The AI business landscape,"5 awesome Google Keep features you aren't using, but should be",Wide & Deep Learning: Better Together with TensorFlow
256,1031060816592502094,Evernote anuncia integração com Google Drive | Google Discovery,A Googler analyzed a billion files to settle the programming dispute made famous by HBO's 'Silicon Valley',The technology behind preview photos,Testes unitários vs aceitação - Android Dev BR,Funcionários do mês no CoolHow: os Slackbots - CoolHow Creative Lab,The Ten Commandments of Egoless Programming
257,3598164602856140626,"Netflix OSS, Spring Cloud, or Kubernetes? How About All of Them!",Notes on Reactive Programming Part I: The Reactive Landscape,Lessons from converting an app to 100% Kotlin - Keepsafe Engineering,"Enterprises fighting back, Spring Boot is the best, and other SpringOne Platform takeaways",The Netflix Tech Blog: Engineering Trade-Offs and The Netflix API Re-Architecture,Serverless Architectures
258,-6726685468116057064,Steak Tartare com Salada Verde,Conheça 20 atletas LGBT que vão competir nas Olimpíadas do Rio,Este site quer conectar profissionais trans e travestis a empresas que não têm preconceito,Good developers take breaks * Greetings Programs,The Genderbread Person v3 | It's Pronounced Metrosexual,Introducing Ask a Female Engineer
259,-2808969983997441543,CSS Containment in Chrome 52 | Web Updates - Google Developers,"Apple's new file manager, APFS, is awesome",The five phases of migrating to Google Cloud Platform,19 Tips For Everyday Git Use,Leveling Up Your JavaScript -,What to Inspect When You are Inspecting!
260,4118743389464105405,Why Google App Engine rocks: A Google engineer's take,The AI business landscape,"Hello, TensorFlow!",How Mark Zuckerberg Led Facebook's War to Crush Google Plus,"Amazon open-sources its own deep learning software, DSSTNE",Google lags behind Amazon and Microsoft's cloud in one important area
261,3998743085432844199,Netflix emociona com vídeo destacando personagens LGBT,YouTube chama seus criadores de conteúdo para a campanha mundial #OrgulhoDeSer,Pabllo Vittar reina no novo comercial da Skol para os Jogos Olímpicos,"Para rebater Estatuto da Família, campanha muda significado de 'família' no Dicionário Houaiss","TRF mantém resolução que proíbe ""cura gay"" - Jornal Opção","No dia das mães, Avon lança campanha com mãe de jovem gay"
262,9220445660318725468,Angular 2,Acesse a versão Material Design do YouTube | Google Discovery,How I sped up the initial render of my Polymer app by 86%,"HoloLens, da Microsoft, engana o usuário para consertar conexões falhas do cérebro","Feather: A Fast On-Disk Format for Data Frames for R and Python, powered by Apache Arrow",15 Awesome Sublime Text Plugins For Web Development
263,5928346445655989915,[Tools] A Tool for tracking Kanban projects (that you can cut out and keep) - Emily Webber,"Feather: A Fast On-Disk Format for Data Frames for R and Python, powered by Apache Arrow",Pesquisadores do MIT desenvolvem tecnologia que digitaliza livros fechados - Geek,[E-learning] Design Thinking for Innovation - University of Virginia | Coursera,6 reasons why I like KeystoneML,Angular 2
264,-4625438649010928449,Top Asset Tracking Software: The 52 Best Tools and Software Solutions to Track Your Company's Vital Physical Assets,Gartner Reprint,Gartner Reprint,Conselho da SABMiller aceita proposta de compra da AB InBev,Smart Contact Lens-Eyeglass Combo Could Monitors Diabetes and Delivers Drugs,Introducing New Relic Infrastructure
265,7400903238402587728,Inbox by Gmail ganha formatação de texto | Google Discovery,"Google launches Springboard, an AI-powered assistant for its enterprise customers",Touch (TV Series 2012-2013),"Deep-learning algorithm predicts photos' memorability at ""near-human"" levels",Here's proof that Google is getting serious about battling Facebook in a key area,"Secret's founder returns with Bold, a Medium for enterprise"
266,7520301770873472812,Aplicativo gratuito permite gerenciar Consórcio Honda diretamente do celular - Notícias - Auto Estrada,Creating value in auto finance with vLendRight | Kevin Moseri,Especial Agrishow: Soluções de agricultura de precisão elevam produtividade e aumentam a qualidade do plantio,Google acquires deep search engine Kifi to enhance its Spaces group chat app,"Carne artificial acabará com o agronegócio brasileiro, afirma especialista",Samsung lança dispositivo para deixar carro conectado a partir de chip 4G - Link - Estadão
267,7804826445069770894,"Secret's founder returns with Bold, a Medium for enterprise",The AI business landscape,5 reasons your employees aren't sharing their knowledge,Why Google App Engine rocks: A Google engineer's take,Touch (TV Series 2012-2013),"Google launches Springboard, an AI-powered assistant for its enterprise customers"
268,-7566966163569468290,Watch Google's AI master the infamously difficult Atari game Montezuma's Revenge,Transfer Style But Not Color,"BigQuery 1.11, now with Standard SQL, IAM, and partitioned tables! | Google Cloud Big Data and Machine Learning Blog",Google lags behind Amazon and Microsoft's cloud in one important area,Machine Learning Is Redefining The Enterprise In 2016,Skill swarms - a new way to share expertise and work smarter together - Skillhive
269,-1523691178084871,Measuring email effectiveness in retail banking,Bradesco vai testar tecnologia por trás do bitcoin em São Paulo,Confused by blockchains? Revolution vs Evolution,Banking Needs a Customer Experience Wake-Up Call,Making open source data more available,Nubank começa a testar seu programa de fidelidade - Empresas Tech
270,-7399665664688732365,Touch (TV Series 2012-2013),The AI business landscape,Here's proof that Google is getting serious about battling Facebook in a key area,Lilly Wachowski Makes First Public Appearance Since Coming Out as Transgender,"Secret's founder returns with Bold, a Medium for enterprise",The Physical Web
271,-1444481301861872291,Nova campanha da Avon tem drag queen como estrela,"Para rebater Estatuto da Família, campanha muda significado de 'família' no Dicionário Houaiss",Pabllo Vittar reina no novo comercial da Skol para os Jogos Olímpicos,Netflix emociona com vídeo destacando personagens LGBT,Amazon causa polêmica com serviço que faz entregas em 1 hora em Paris,"TRF mantém resolução que proíbe ""cura gay"" - Jornal Opção"
272,4045164454094417310,1º Congresso Brasileiro de IoT - Embarcados,Burger King aceita pedidos via mensagens no Facebook - Startupi,Google usa aprendizado de máquina para melhorar imagens de baixa qualidade | Google Discovery,"Por dentro do MariaLab: A tecnologia é área para as mulheres, sim!",Nova pulseira tecnológica avisa se você já bebeu demais,Aprendizado de máquina do Google pode detectar retinopatia diabética | Google Discovery
273,5302085907556673015,Google employees are adding 'Lady' to their job titles to fight sexism,9 Non-Threatening Leadership Strategies for Women,Netflix emociona com vídeo destacando personagens LGBT,Susan Wojcicki on the Effectiveness of Empowering Ads on YouTube,"Meet Bozoma Saint John, the Apple executive who stole the show at WWDC",Bad Writing Is Destroying Your Company's Productivity
274,7255021292858609470,An operating model for company-wide agile development,Big IT Rising,"Salesforce buys Demandware for $2.8B, taking a big step into e-commerce",Embracing Agile,"Deep Learning for Chatbots, Part 2 - Implementing a Retrieval-Based Model in Tensorflow",An operating model for company-wide agile development
275,4139191914110236238,An operating model for company-wide agile development,Staying one step ahead at Pixar: An interview with Ed Catmull,The return of the machinery question,7 Questions to Ask Before Your Next Digital Transformation,Two Different Sales Motions . . . .,Diane Greene wants to put the enterprise front and center of Google Cloud strategy
276,6941466664989793964,Accenture amplia atuação no Brasil,You won't recognize the new world of digital payments without this report,Nubank pode fechar as portas se BC confirmar mudança amanhã,Can Accenture Take Over Advertising?,O tênue equilíbrio da equipe que desenha produtos digitais,Visa lança desafio para startups de tecnologia - Startupi
277,5962268176939710955,"BigQuery 1.11, now with Standard SQL, IAM, and partitioned tables! | Google Cloud Big Data and Machine Learning Blog",Chat Smarter with Allo,Google lags behind Amazon and Microsoft's cloud in one important area,How Mark Zuckerberg Led Facebook's War to Crush Google Plus,Graph Capabilities with the Elastic Stack,Introduction to release engineering
278,-3723217532224917485,11 Internet of Things (IoT) Protocols You Need to Know About,Comparing IoT Platforms: Compare 4 IoT platform for IoT projects,NodeMCU (ESP8266) o módulo que desbanca o Arduino e facilitará a Internet das Coisas...,One Dollar Board: Um projeto brasileiro para revolucionar a educação,Como a Microsoft está trabalhando com o conceito de IoT - Startupi,Raspberry Pi with cloud vision at Google I/O - Raspberry Pi
