,contentId,If you liked,Recommendation 1,Recommendation 2,Recommendation 3,Recommendation 4,Recommendation 5
554,7187598944032799890,Top 15 Facebook Open Source Projects You Must Know,Four Node.js Gotchas that Operations Teams Should Know about - The New Stack,"Why Performance Matters, Part 1: The Perception Of Time - Smashing Magazine",Mobify report reveals impact of mobile website speed,Mercado de Cosméticos no Brasil - Setor que não conhece crise!,Things you probably didn't know you could do with Chrome's Developer Console
555,-793729620925729327,Closure Compiler in JavaScript,A Googler analyzed a billion files to settle the programming dispute made famous by HBO's 'Silicon Valley',Elastic Stack 5.0.0 Released,"CSP Is Dead, Long Live CSP! On the Insecurity of Whitelists and the Future of Content Security Policy",Chrome OS now has Material Design for the desktop,Android Studio 2.2
556,3495098006178009360,A Googler analyzed a billion files to settle the programming dispute made famous by HBO's 'Silicon Valley',Evernote anuncia integração com Google Drive | Google Discovery,The technology behind preview photos,How I sped up the initial render of my Polymer app by 86%,"HoloLens, da Microsoft, engana o usuário para consertar conexões falhas do cérebro",Chrome OS now has Material Design for the desktop
557,-5684357871122991503,MOBILE TIME - Youse: seguradora digital se diferencia através da interface móvel,The surprising truth about which countries lead in digital,The new tech talent you need to succeed in digital,Why Deep Learning Is Suddenly Changing Your Life,How will bots make money? Here are 7 business models,Organizing for digital acceleration: Making a two-speed IT operating model work
558,7507067965574797372,Um bilhão de arquivos mostram quem vence a disputa tabs vs. espaços entre programadores,"How to build a robot that ""sees"" with $100 and TensorFlow",What is WebAssembly? The Dawn of a New Era - JavaScript Scene,Burger King aceita pedidos via mensagens no Facebook - Startupi,Dark Scrum,Inteligência artificial da IBM criou 'trailer perfeito' para filme
559,-6772940823843058601,Visa inaugura centro para inovação em pagamento digital | EXAME.com,Android Developers Summer Reading List,"How to build a robot that ""sees"" with $100 and TensorFlow",Why Silicon Valley is all wrong about Apple's AirPods - Chris Messina,The Business Case for Progressive Web Apps,15 Interesting JavaScript and CSS Libraries for October 2016
560,-5446204508747882127,bliki: StranglerApplication,Creating Your Code Review Checklist - DaedTech,The Ultimate Solution to Versioning REST APIs: Content Negotiation,The hardest thing in computer science,On DRY and the cost of wrongful abstractions,Building Spring Cloud Microservices That Strangle Legacy Systems
561,-3666646454167334466,Benchmarks for the Top Server-Side Swift Frameworks vs. Node.js,Ciclistas relatam roubos com agressividade na avenida dos Andradas,Google I/O 2016: Android's failure to innovate hands a Apple free run at WWDC,Why and How to Avoid Hamburger Menus - Louie A. - Mobile UX Design,Cubr,Mastercard lança plataforma de APIs abertas para soluções de pagamentos - Startupi
562,-3944300307678659798,DBA BRASIL no INTEROPMIX 2016,Why Silicon Valley is all wrong about Apple's AirPods - Chris Messina,Elastic Stack 5.0.0 Released,Internet of Things Drives Outcome-Based Business Models,Closure Compiler in JavaScript,Aprendizado de máquina do Google pode detectar retinopatia diabética | Google Discovery
563,4039031731864440026,Olli: Artificial Intelligence for the real world of connected commuting,Chrome OS now has Material Design for the desktop,Advanced Android Espresso,Migrating from Parse to Bluemix,Android Studio 2.2,Elastic Stack 5.0.0 Released
564,-2358756719610361882,Custo do Erro - Cinco motivos para investir em automação de testes,Google Cloud Platform's preemptible VMs are now up to 33% cheaper,Visual Thinking and Learning 3.0 working together at Walmart.com | Happy Melly,Closure Compiler in JavaScript,Micro Profile JavaEE com Wildfly Swarm,Startups apostam em aplicativos que conectam fretes e caminhoneiros
565,-3716447017462787559,Squads não-suicidas - Hipsters #08,Progressive Web App - first introduced on Google I/O | airberlin,How I sped up the initial render of my Polymer app by 86%,"Deep Learning for Chatbots, Part 2 - Implementing a Retrieval-Based Model in Tensorflow",This Super Accurate Portrait Selection Tech Uses Neural Networks,Wide & Deep Learning: Better Together with TensorFlow
566,-7518373517401484139,My favorite people and resources to learn Android programming from,Post: Just Say mNo to Hungarian Notation,Firebase Test Lab for Android,Advanced Android Espresso,The Importance of Code Reviews,StrictMode for Runtime Analysis on Android - Google Developers
567,-1403735753867098241,"The ""Joel Test"" for Data Science",Google's Cloud Machine Learning service is now in public beta,Scala is the new golden child,Spark comparison: AWS vs. GCP,Power to the People: How One Unknown Group of Researchers Holds the Key to Using AI to Solve Real...,"Feather: A Fast On-Disk Format for Data Frames for R and Python, powered by Apache Arrow"
568,3273084325487543386,The surprising truth about which countries lead in digital,MOBILE TIME - Youse: seguradora digital se diferencia através da interface móvel,The new tech talent you need to succeed in digital,Can Accenture Take Over Advertising?,55 fornecedores de TI que apresentarão novidades no Ciab 2016,The future of the shopping mall
569,-5088157426675091741,Dez habilidades profissionais mais valorizadas em projetos de Internet das Coisas - CIO,Uma arquitetura de referência para a Internet das Coisas - Parte 1,Nova pulseira tecnológica avisa se você já bebeu demais,Governo abre consulta pública para Plano Nacional de IoT | NOTÍCIAS - Brasscom,Governo define cronograma para plano nacional de Internet das Coisas,Top 30 Commonly Confused Words in English
570,39554158227241538,Campus São Paulo: conheça a primeira turma do Programa de Residentes,O tênue equilíbrio da equipe que desenha produtos digitais,Chatbots: Are they better without the chat?,#FinTech is all about human-centred design - Chris Skinner's blog,Running GV sprints inside corporates - learn from my mistakes - Sprint Stories,Transforming life insurance with design thinking
571,-5198756378866433953,Who sponsors Drupal development? | Dries Buytaert,Acquia Engage Awards Finalists Announced,7 Questions to Ask Before Your Next Digital Transformation,Dries Buytaert,The return of the machinery question,The Death of Drupal Commerce as an Ecommerce Solution - Third & Grove
572,5008913705695203000,Post: Just Say mNo to Hungarian Notation,The Importance of Code Reviews,Sam Newman - Backends For Frontends,Firebase Test Lab for Android,Up your app's sharing game with DirectShare - Google Developers,Pull request first - Practical Blend
573,-8511291357261863413,Dark Scrum,Post: Just Say mNo to Hungarian Notation,Sam Newman - Backends For Frontends,Alecrim/AlecrimCoreData,The Importance of Code Reviews,Firebase Test Lab for Android
574,-8377626164558006982,Bad Writing Is Destroying Your Company's Productivity,Text summarization with TensorFlow,AI Is Here to Help You Write Emails People Will Actually Read,Algorithms and architecture for job recommendations,The AI business landscape,How Mark Zuckerberg Led Facebook's War to Crush Google Plus
575,3367026768872537336,Seja esperto no trabalho: Melhore a comunicação na empresa com 12 robôs,The moment when you realize every server in the world is vulnerable - Free Code Camp,Evernote anuncia integração com Google Drive | Google Discovery,The technology behind preview photos,Learning How to Learn: The Most Important Developer Skill - Free Code Camp,Internet of Things Drives Outcome-Based Business Models
576,8115033558441775155,"A whole new GitHub Universe: announcing new tools, forums, and features",Santander Vies to Become First Bank to Issue Cash on Blockchain - CoinDesk,Quick Tip: Working with the JavaScript Battery API,Comparing React.js to Vue.js for dynamic tabular data,Android Studio 2.2,Building Flipkart Lite: A Progressive Web App
577,5018472516978866574,The Internet of Things is looking for its VisiCalc,Power to the People: How One Unknown Group of Researchers Holds the Key to Using AI to Solve Real...,Nintendo has doubled in value since Pokémon Go's release,How enterprise architects can help ensure success with digital transformations,Machine Learning Is Redefining The Enterprise In 2016,The barbell effect of machine learning.
578,156889606517612871,Multi-Channel Marketing in 2015 - It's not rocket science.,AEM 6.1 Package Manager Metadata Files,WeChat's world,Acquia Engage Awards Finalists Announced,"Amazon still crushing cloud competition, says Gartner Magic Quadrant for IaaS - TechRepublic",Nintendo has doubled in value since Pokémon Go's release
579,-6603970730135147059,Pesquisadores do MIT desenvolvem tecnologia que digitaliza livros fechados - Geek,[Tools] A Tool for tracking Kanban projects (that you can cut out and keep) - Emily Webber,"Feather: A Fast On-Disk Format for Data Frames for R and Python, powered by Apache Arrow",Client-side ranking to more efficiently show people stories in feed,Novas frentes de trabalho da Alelo vão de ações de fidelidade a novos meios de pagamento,Visa inaugura Co-Creation Center em São Paulo
580,-4655195825208522542,Java 9 na prática: Jigsaw,Java vs .NET vs Python vs Ruby vs Node.JS: Who Reigns the Job Market? | Takipi Blog,BDD Best Practices and Guidelines - Testing Excellence,Advanced Android Espresso,My favorite people and resources to learn Android programming from,Angular 2 versus React: There Will Be Blood - Free Code Camp
581,-6545872007932025533,Why Silicon Valley is all wrong about Apple's AirPods - Chris Messina,Android Developers Summer Reading List,DBA BRASIL no INTEROPMIX 2016,Visa inaugura centro para inovação em pagamento digital | EXAME.com,bliki: StranglerApplication,Closure Compiler in JavaScript
582,-4084394822880420062,Android Studio 2.2,"A whole new GitHub Universe: announcing new tools, forums, and features",Elastic Stack 5.0.0 Released,Quick Tip: Working with the JavaScript Battery API,Olli: Artificial Intelligence for the real world of connected commuting,My favorite people and resources to learn Android programming from
583,7985545205318799060,On DRY and the cost of wrongful abstractions,Creating Your Code Review Checklist - DaedTech,My favorite people and resources to learn Android programming from,The Importance of Code Reviews,Learning How to Learn: The Most Important Developer Skill - Free Code Camp,Post: Just Say mNo to Hungarian Notation
584,-2720012228333470715,Nubank começa a testar seu programa de fidelidade - Empresas Tech,Mobile banking conquista o coração dos brasileiros,CMN regulamenta abertura de conta de depósito por meio eletrônico,Novas frentes de trabalho da Alelo vão de ações de fidelidade a novos meios de pagamento,"Say goodbye to traditional customer segmentation "" Banking Technology",Cade autoriza Itaú Unibanco e Mastercard a criarem nova bandeira de cartão
585,-3302834510061927448,Bayer anuncia compra da Monsanto por US$ 66 bilhões,Will blockchain drive the fourth Industrial Revolution?,Bayer propõe comprar Monsanto para formar a maior agroquímica do mundo,Agronegócio mantém crescimento com tecnologia - inova.jor,Skill swarms - a new way to share expertise and work smarter together - Skillhive,Docker e .Net
586,-8964534883296838326,Why Evernote Is Giving Up on Its Data Centers for Google Cloud,New settings for 2-Step Verification,Artificial intelligence is changing SEO faster than you think,"CSP Is Dead, Long Live CSP! On the Insecurity of Whitelists and the Future of Content Security Policy",Google cloud boss Diane Greene: We're winning against AWS and Microsoft,How the queen of Silicon Valley is helping Google go after Amazon's most profitable business
587,-6707474286910397949,The Death of Drupal Commerce as an Ecommerce Solution - Third & Grove,"Google Pixel, o primeiro smartphone feito pelo Google | Google Discovery",An overview of web service solutions in Drupal 8,Lightning Distribution for Drupal: Build Advanced Authoring Experiences in Drupal 8,Acquia Engage Awards Finalists Announced,Dries Buytaert
588,8886002764685330098,Exploring Java's Hidden Costs,Power to the People: How One Unknown Group of Researchers Holds the Key to Using AI to Solve Real...,The Internet of Things is looking for its VisiCalc,My favorite people and resources to learn Android programming from,Lessons from converting an app to 100% Kotlin - Keepsafe Engineering,Combining Spring Boot and JDBI
589,-4145260601063545880,Why Learning Angular 2 Was Excruciating,My experience with Google's Associate Android Developer Certification,Top 10 Insurtech Trends for 2017 - Insurance Thought Leadership,Jenkins 2.0 is here!,Microsoft's Open Source Love Affair Reaches New Heights,SOA com microserviços - Sensedia
590,-7623502978685822577,"Don't Start Big, Start a Little Snowball","Why Performance Matters, Part 1: The Perception Of Time - Smashing Magazine",Mobify report reveals impact of mobile website speed,Things you probably didn't know you could do with Chrome's Developer Console,Four Node.js Gotchas that Operations Teams Should Know about - The New Stack,Top 15 Facebook Open Source Projects You Must Know
591,-5414889822782394955,6 exemplos de como usar computação cognitiva | EXAME.com,MOBILE TIME - Shoppings do Rio testarão solução de marketing com beacons,Mobile Time,The new tech talent you need to succeed in digital,The future of the shopping mall,Visa e Swatch lançam relógio para pagamentos contactless no Brasil - Startupi
592,6881796783400625893,Santander Vies to Become First Bank to Issue Cash on Blockchain - CoinDesk,Quick Tip: Working with the JavaScript Battery API,"A whole new GitHub Universe: announcing new tools, forums, and features",Comparing React.js to Vue.js for dynamic tabular data,Building Flipkart Lite: A Progressive Web App,CMN regulamenta abertura de conta de depósito por meio eletrônico
593,2229625391864201918,Como o layout de aplicativos influencia o usuário e por que você deveria testá-lo - One Day Testing Blog,Top 5 Android Testing Frameworks with Examples,Resenha - A Chegada,"Espresso Intents: não é magia, é tecnologia! - Android Dev BR",Apenas US$ 59: Nintendo anuncia o relançamento do Nintendinho com 30 jogos na memória,Dicas avançadas de ruby (capybara/cucumber)
594,7458850059926549081,Bring Your App To Life with CALayers,Why and How to Avoid Hamburger Menus - Louie A. - Mobile UX Design,Twitter faz atualização em seu aplicativo Fabric para trazer mais funcionalidades às empresas e aos desenvolvedores de apps - Startupi,Building a Team from the Inside Out: Alok Gupta on the Evolution of Data Science at Airbnb,Building interfaces with ConstraintLayout - Google Developers,Facebook's Artificial Intelligence Research lab releases open source fastText on GitHub
595,2602221055863892168,Ultrapar aprova investimento adicional de R$ 196 milhões para a Ipiranga,Startups apostam em aplicativos que conectam fretes e caminhoneiros,Conselho da SABMiller aceita proposta de compra da AB InBev,Gartner Reprint,Top Asset Tracking Software: The 52 Best Tools and Software Solutions to Track Your Company's Vital Physical Assets,"Vale reverte prejuízo e tem lucro de R$ 1,8 bilhão no 3º trimestre"
596,139485217095648183,Supercharge Java Auth with JSON Web Tokens (JWTs) | Baeldung,Top Programming Languages Trends: The Rise of Big Data,Test and deploy to Google App Engine with the new Maven and Gradle plugins,Gartner Reprint,Assessing Salesforce's platform and ecosystem | ZDNet,Java Microservices: The Cake is a Lie but You Can't Ignore It | Takipi Blog
597,6031953227014493100,O chefe é gay. E daí?,YouTube chama seus criadores de conteúdo para a campanha mundial #OrgulhoDeSer,The Genderbread Person v3 | It's Pronounced Metrosexual,"TRF mantém resolução que proíbe ""cura gay"" - Jornal Opção",Pabllo Vittar reina no novo comercial da Skol para os Jogos Olímpicos,Introducing Ask a Female Engineer
598,9175693555063886126,15 minutos sobre Docker,Using Microservices Architecture as API Enablement Strategy,Arquitetura de Microserviços habilitando APIs - Sensedia,Contêiner do Windows no Windows 10,Most Interesting APIs in 2016: Cognitive Computing,Custo do Erro - Cinco motivos para investir em automação de testes
599,7226503561499839165,"Zuul 2 : The Netflix Journey to Asynchronous, Non-Blocking Systems",Serverless real-time architecture on AWS: there is a way !,"Building A Modern, Scalable Backend: Modernizing Monolithic Applications",Microservices Architecture on Google App Engine,Building Spring Cloud Microservices That Strangle Legacy Systems,"Tabs vs Spaces: How They Write Java at Google, Twitter, Mozilla and Pied Piper | Takipi Blog"
600,8734156751308150579,Bitcoin Accepted! German Energy Giant Enables Payments - CCN: Financial Bitcoin & Cryptocurrency News,Diane Greene wants to put the enterprise front and center of Google Cloud strategy,One Dollar Board: Um projeto brasileiro para revolucionar a educação,Carteira inteligente tem trava biométrica e controle por aplicativo - Gadgets,Will blockchain drive the fourth Industrial Revolution?,Ultimate AI battle - Apple vs. Google
601,6817244649248188271,Desenvolvimento de Aplicativos Mobile com Xamarin -,Most Interesting APIs in 2016: Cognitive Computing,Mastercard lança plataforma de APIs abertas para soluções de pagamentos - Startupi,Eddy Cue and Craig Federighi Open Up About Learning From Apple's Failures,Test and deploy to Google App Engine with the new Maven and Gradle plugins,Beyond Progressive Web Apps Part 1
602,-6400214860728938634,"How to build a robot that ""sees"" with $100 and TensorFlow",15 Interesting JavaScript and CSS Libraries for October 2016,Dark Scrum,Cubr,Visa inaugura centro para inovação em pagamento digital | EXAME.com,Um bilhão de arquivos mostram quem vence a disputa tabs vs. espaços entre programadores
603,7993526700719577624,What Science Tells Us About Leadership Potential,Power to the People: How One Unknown Group of Researchers Holds the Key to Using AI to Solve Real...,O valor de seu trabalho de coaching vai depender de suas habilidades de acompanhamento - Harvard Business Review Brasil,Cinco competências comportamentais para você ser um bom líder,"Para neurociência, motivação não é fator principal em mudança de hábitos",Investimentos em coaching e mentoring aumentam nas empresas
604,4577451034168098359,Cubr,Serverless Data Sync in Web Apps with Bit Torrent,"Autofill: What web devs should know, but don't",Bot Design Patterns,"How to build a robot that ""sees"" with $100 and TensorFlow",Torus
605,-2069509552243850466,Contêiner do Windows no Windows 10,15 minutos sobre Docker,Most Interesting APIs in 2016: Cognitive Computing,Aprendizado de máquina do Google pode detectar retinopatia diabética | Google Discovery,"Chrome 53 Beta: Shadow DOM, PaymentRequest, and Android autoplay",Top Programming Languages Trends: The Rise of Big Data
606,6664082205633624486,Building a Team from the Inside Out: Alok Gupta on the Evolution of Data Science at Airbnb,Cordova iOS Performance Improvements: Drop-in Speed with WKWebView,Microservices Architecture on Google App Engine,Power to the People: How One Unknown Group of Researchers Holds the Key to Using AI to Solve Real...,Facebook's Artificial Intelligence Research lab releases open source fastText on GitHub,The Internet of Things is looking for its VisiCalc
607,4785499183287168509,The new tech talent you need to succeed in digital,The economic essentials of digital strategy,PwC faz virada digital e já fatura US$ 1 bilhão no mundo,6 exemplos de como usar computação cognitiva | EXAME.com,Liberty vai adotar telemetria e baratear seguro para bons motoristas,Mobile Time
608,-5154395767417065070,Innovation is in all the wrong places,This Super Accurate Portrait Selection Tech Uses Neural Networks,Google's Cloud Machine Learning service is now in public beta,We are on the verge of a consumer M&A avalanche,Transfer Style But Not Color,"The ""Joel Test"" for Data Science"
609,5211673327552264703,Google Cloud Platform sets a course for new horizons,"Google is discontinuing Google+ Hangouts On Air on September 12, pushes users to YouTube Live",Two Different Sales Motions . . . .,"Google Cloud Platform icons and sample architectural diagrams, for your designing pleasure",Nintendo has doubled in value since Pokémon Go's release,Diane Greene wants to put the enterprise front and center of Google Cloud strategy
610,8779890754987103603,Mastercard lança plataforma de APIs abertas para soluções de pagamentos - Startupi,SOA com microserviços - Sensedia,Slack and Google announce partnership focused on better integrating their services,Top 10 Insurtech Trends for 2017 - Insurance Thought Leadership,Microsoft's Open Source Love Affair Reaches New Heights,Facebook is open-sourcing its AI bot-building research
611,-9033211547111606164,Google's Cloud Machine Learning service is now in public beta,Machine Learning Is No Longer Just for Experts,Spark comparison: AWS vs. GCP,Algorithms and architecture for job recommendations,Scala is the new golden child,"The ""Joel Test"" for Data Science"
612,-6654470039478316910,Advanced Android Espresso,My favorite people and resources to learn Android programming from,Post: Just Say mNo to Hungarian Notation,Firebase Test Lab for Android,You SHOULD Learn Vanilla JavaScript Before JS Frameworks - Snipcart,The Importance of Code Reviews
613,834896074125772354,So you want to sell to banks?,Ray Kurzweil: The world isn't getting worse - our information is getting better,Time to Re-Think Design Thinking,Itaú é pioneiro do blockchain,Nubank pode fechar as portas se BC confirmar mudança amanhã,The surprising truth about which countries lead in digital
614,-3850803681204406658,Novas frentes de trabalho da Alelo vão de ações de fidelidade a novos meios de pagamento,CMN regulamenta abertura de conta de depósito por meio eletrônico,Visa inaugura Co-Creation Center em São Paulo,Mobile Time,Nubank começa a testar seu programa de fidelidade - Empresas Tech,The new tech talent you need to succeed in digital
615,-4996336942690402156,Live asynchronously.,Client-side ranking to more efficiently show people stories in feed,O manual do deboísta corporativo,Seniority,"Meet Mycroft, the open source AI who wants to rival Siri, Cortana, and Alexa | ZDNet",Berners-Lee quer criar outra Web
616,-5920475612630001479,How it feels to learn Javascript in 2016,Node.js Best Practices - How to Become a Better Developer in 2017 | @RisingStack,Ciclistas relatam roubos com agressividade na avenida dos Andradas,Java Tools and Technologies Landscape Report 2016 | zeroturnaround.com,Berners-Lee quer criar outra Web,"Google Pixel, o primeiro smartphone feito pelo Google | Google Discovery"
617,3467834993860080188,15 Interesting JavaScript and CSS Libraries for October 2016,"How to build a robot that ""sees"" with $100 and TensorFlow",Visa inaugura centro para inovação em pagamento digital | EXAME.com,Dark Scrum,The Java 8 API Design Principles,Um bilhão de arquivos mostram quem vence a disputa tabs vs. espaços entre programadores
618,7013665235990336340,Itaú Unibanco fecha compra de ativos de varejo do Citi no Brasil,Abrimos uma conta no Original.,Nubank começa a testar seu programa de fidelidade - Empresas Tech,"Em 2017 será possível ignorar totalmente o cartão físico, garante Itaú",Este site quer conectar profissionais trans e travestis a empresas que não têm preconceito,Engineering Digital Banking Solutions Using UX Methodology
619,-8800029253812071912,"Facebook Workplace officially launches on the web and iOS, set to compete head-on with Slack","Deep-learning algorithm predicts photos' memorability at ""near-human"" levels",Ordering coffee in Italy: the 10 commandments,WWDC 2016 preview: How to watch &amp; what to expect at Apple's event on Monday,Joel on Software,"AWS vs Packet.net Why we left AWS Benchmarking AWS's Network, Disk, and CPU Performance - Tiingo Thoughts"
620,-5658245291907121574,Machine Learning and the VP Debate,"How Google is Remaking Itself as a ""Machine Learning First"" Company - Backchannel",5 reasons your employees aren't sharing their knowledge,Top 10 Intranet Trends of 2016,"Deep Learning for Chatbots, Part 2 - Implementing a Retrieval-Based Model in Tensorflow",AI Is Here to Help You Write Emails People Will Actually Read
621,-7527881206365368,De piada sobre TPM a servir cafezinho: como lidar com machismo no trabalho?,Mulheres são mais criativas que homens?,Susan Wojcicki on the Effectiveness of Empowering Ads on YouTube,O que é liderança? Liderança é fazer a diversidade funcionar.,Não ao preconceito! ONU celebra Dia da Visibilidade de Mulheres Lésbicas e Bissexuais,O chefe é gay. E daí?
622,5854206600849997966,The hardest thing in computer science,bliki: StranglerApplication,"Building A Modern, Scalable Backend: Modernizing Monolithic Applications","GitHub broke my 1,000 day streak - Free Code Camp",The Java 8 API Design Principles,"Meet Mycroft, the open source AI who wants to rival Siri, Cortana, and Alexa | ZDNet"
623,6678691743269420670,Why Deep Learning Is Suddenly Changing Your Life,How will bots make money? Here are 7 business models,This Super Accurate Portrait Selection Tech Uses Neural Networks,"Deep Learning for Chatbots, Part 2 - Implementing a Retrieval-Based Model in Tensorflow",Blaise Agüera y Arcas: How computers are learning to be creative,Duolingo's chatbots help you learn a new language
