,contentId,If you liked,Recommendation 1,Recommendation 2,Recommendation 3,Recommendation 4,Recommendation 5
418,2727743992157210358,The Future of Digital Banking is Now,Ordering coffee in Italy: the 10 commandments,"AWS vs Packet.net Why we left AWS Benchmarking AWS's Network, Disk, and CPU Performance - Tiingo Thoughts",Joel on Software,WWDC 2016 preview: How to watch &amp; what to expect at Apple's event on Monday,What to Expect at WWDC 2016
419,-6643406494673362190,Vendas da Netshoes crescem 267% em dispositivos móveis no 1º semestre - 24Brasil,Não existe frete grátis!,Mercado de Cosméticos no Brasil - Setor que não conhece crise!,"Building A Modern, Scalable Backend: Modernizing Monolithic Applications",Amazon causa polêmica com serviço que faz entregas em 1 hora em Paris,Four Node.js Gotchas that Operations Teams Should Know about - The New Stack
420,-6783772548752091658,Livro: Retrospectivas Divertidas,Cinco competências comportamentais para você ser um bom líder,Amazon causa polêmica com serviço que faz entregas em 1 hora em Paris,[Tools] A Tool for tracking Kanban projects (that you can cut out and keep) - Emily Webber,So you want to sell to banks?,How One Jira Ticket Made My Employer $1MM/Month: 7 Metrics that Actually Matter - JavaScript Scene
421,-548976469460064550,Using Honcho to Create a Multi-Process Docker Container,DevOps requer profundas mudanças operacionais que o CIO precisa promover - CIO,"Docker - Build, Ship, and Run Any App, Anywhere",Introduction to release engineering,The Continuous Delivery Maturity Model,"DevOps security requires new mindset and tools for visibility, automation"
422,-1596335233529956315,Why Kubernetes may be a bigger threat to Amazon than Google's cloud - TechRepublic,VMware Cloud™ on AWS - A Closer Look - frankdenneman.nl,"contentId
8962537427807366481    Why It's Time to Take Google's PC Operating Sy...
8962537427807366481    Why It's Time to Take Google's PC Operating Sy...
Name: title, dtype: object",Firebase and Google Cloud: better together,Eclipse Foundation Releases Neon,Microservices Architecture on Google App Engine
423,-5848755753905481990,"Incrível, Skype se lembrou que o Linux existe!","Tabs vs Spaces: How They Write Java at Google, Twitter, Mozilla and Pied Piper | Takipi Blog",Firebase and Google Cloud: better together,VMware Cloud™ on AWS - A Closer Look - frankdenneman.nl,Google Cloud Platform's preemptible VMs are now up to 33% cheaper,Programação Reativa Funcional com RxJava
424,2362495898257544462,How Do Top Android Developers QA Test Their Apps?,Visa inaugura Co-Creation Center em São Paulo,VMware Cloud™ on AWS - A Closer Look - frankdenneman.nl,Firebase and Google Cloud: better together,Python Is Not Java (dirtSimple.org),Creating Compound Views on Android
425,1768976290984301641,Top 5 Android Testing Frameworks with Examples,"Espresso Intents: não é magia, é tecnologia! - Android Dev BR",Como o layout de aplicativos influencia o usuário e por que você deveria testá-lo - One Day Testing Blog,Dicas avançadas de ruby (capybara/cucumber),Microservices testing,The Broken Window Theory
426,667643281369196267,Java Tools and Technologies Landscape Report 2016 | zeroturnaround.com,"Tabs vs Spaces: How They Write Java at Google, Twitter, Mozilla and Pied Piper | Takipi Blog",How it feels to learn Javascript in 2016,Node.js Best Practices - How to Become a Better Developer in 2017 | @RisingStack,Google Cloud Platform's preemptible VMs are now up to 33% cheaper,Elastic Stack 5.0.0 Released
427,3881851296308711302,Developing Android unit and instrumentation tests - Tutorial,Testes unitários vs aceitação - Android Dev BR,"Fresco, sim! - Android Dev BR",Using DiffUtil in Android RecyclerView,Como Usar o Git e o GitHub,Top 5 Android Testing Frameworks with Examples
428,464601875539492971,Apenas US$ 59: Nintendo anuncia o relançamento do Nintendinho com 30 jogos na memória,Resenha - A Chegada,gotwarlost/istanbul,Como o layout de aplicativos influencia o usuário e por que você deveria testá-lo - One Day Testing Blog,"No Brasil, '25% dos celulares ainda são 'Burrofones'",Creating Compound Views on Android
429,-7570652411388243006,The compelling case to replace a 40-year old core system - Chris Skinner's blog,The Drive to Bank on Digital,Bradesco lança serviço inédito para estimular o hábito de poupar,A identidade visual de Budapeste para as Olimpíadas de 2024,Bradesco e Visa anunciam pulseira que substitui cartão | EXAME.com,How This Former Google Engineer Is Bringing Blockchain to Banks
430,607684800821303652,How This Former Google Engineer Is Bringing Blockchain to Banks,"Elopar lança o ""Digio"", cartão para brigar com Nubank",Bradesco vai lançar novo banco digital: o Next.,Itaú é pioneiro do blockchain,The Drive to Bank on Digital,Nubank pode fechar as portas se BC confirmar mudança amanhã
431,1283472251609674486,Conheça 20 atletas LGBT que vão competir nas Olimpíadas do Rio,Este site quer conectar profissionais trans e travestis a empresas que não têm preconceito,Para entender o Dia Internacional contra a Homofobia,Glamour Exclusive: President Obama On Feminism and The World He Wants to Leave His Daughters,The Genderbread Person v3 | It's Pronounced Metrosexual,Não ao preconceito! ONU celebra Dia da Visibilidade de Mulheres Lésbicas e Bissexuais
432,3779434447835779494,"Hello, a nova rede social do Orkut, está liberada no Brasil","Google launches Springboard, an AI-powered assistant for its enterprise customers",Touch (TV Series 2012-2013),"Google acquires Synergyse, an interactive training service for Google Apps",The AI business landscape,Here's proof that Google is getting serious about battling Facebook in a key area
433,5533752987392101383,7 Questions to Ask Before Your Next Digital Transformation,The return of the machinery question,Two Different Sales Motions . . . .,An operating model for company-wide agile development,"Deep-learning algorithm predicts photos' memorability at ""near-human"" levels",2 terrific #MarTech talks on the rise of AI in marketing - Chief Marketing Technologist
434,7459643459148487877,Grupo de bancos adere à tecnologia do bitcoin em transações,"Em 2017 será possível ignorar totalmente o cartão físico, garante Itaú",Benchmarks for the Top Server-Side Swift Frameworks vs. Node.js,Microsoft's Open Source Love Affair Reaches New Heights,Kotlin no Backend (Parte 2) :: Concrete Solutions,"Agile is Dead, Long Live Continuous Delivery - Gradle"
435,-8369610219380465981,Nintendo has doubled in value since Pokémon Go's release,The Internet of Things is looking for its VisiCalc,How enterprise architects can help ensure success with digital transformations,Power to the People: How One Unknown Group of Researchers Holds the Key to Using AI to Solve Real...,Piloto de caça criado por inteligência artificial vence humano em combate simulado,Machine Learning Is Redefining The Enterprise In 2016
436,-6076367233589223323,Android Developers Summer Reading List,Why Silicon Valley is all wrong about Apple's AirPods - Chris Messina,Visa inaugura centro para inovação em pagamento digital | EXAME.com,Programação Reativa Funcional com RxJava,Using DiffUtil in Android RecyclerView,"Fresco, sim! - Android Dev BR"
437,4259370161044254504,"How I built an app with 500,000 users in 5 days on a $100 server",WeChat's competitor to Slack has arrived,WeChat's world,"Amazon still crushing cloud competition, says Gartner Magic Quadrant for IaaS - TechRepublic","Adobe, Acquia, Episerver Lead New Forrester WCM Wave",Cross-channel user experiences with Drupal
438,-7891293130731329672,Sobre o Hipsters Ponto Tech,Visual Thinking and Learning 3.0 working together at Walmart.com | Happy Melly,Usando o git add interativo,Microservices - When to React Vs. Orchestrate - Capital One DevExchange,Aplicações da Inteligência artificial | Endeavor Brasil,On DRY and the cost of wrongful abstractions
439,2633209697262372913,"Why Performance Matters, Part 1: The Perception Of Time - Smashing Magazine",Four Node.js Gotchas that Operations Teams Should Know about - The New Stack,Mercado de Cosméticos no Brasil - Setor que não conhece crise!,Mobify report reveals impact of mobile website speed,Não existe frete grátis!,"Don't Start Big, Start a Little Snowball"
440,7734121175534200554,"""Consultorias promovem a desvalorização do nosso negócio"" - Meio & Mensagem",MOBILE TIME - FlyHelo: app permite compartilhamento de jatos e helicópteros em São Paulo,"Say goodbye to traditional customer segmentation "" Banking Technology",Mobile banking conquista o coração dos brasileiros,Governo define cronograma para plano nacional de Internet das Coisas,"No Brasil, '25% dos celulares ainda são 'Burrofones'"
441,-3700095596785790870,How to Design a Walkthrough That Users Will Read,"Facebook Workplace officially launches on the web and iOS, set to compete head-on with Slack",Why porting an iOS design to Android will not work,Up your app's sharing game with DirectShare - Google Developers,Designing smart notifications,The Importance of Code Reviews
442,8974280745225397183,Prisma for Android is now live for all in the Google Play Store,The barbell effect of machine learning.,Artificial intelligence produces realistic sounds that fool humans,Power to the People: How One Unknown Group of Researchers Holds the Key to Using AI to Solve Real...,The moment when you realize every server in the world is vulnerable - Free Code Camp,The Internet of Things is looking for its VisiCalc
443,-860751600992244121,Pega até em marte! TP-Link lança extensor de WiFi que tem alcance de 3 km²!,Touch (TV Series 2012-2013),"Hello, a nova rede social do Orkut, está liberada no Brasil",The AI business landscape,Como a Microsoft está trabalhando com o conceito de IoT - Startupi,"Google launches Springboard, an AI-powered assistant for its enterprise customers"
444,1567984561327445971,Testes unitários vs aceitação - Android Dev BR,Using DiffUtil in Android RecyclerView,Evernote anuncia integração com Google Drive | Google Discovery,Developing Android unit and instrumentation tests - Tutorial,"Fresco, sim! - Android Dev BR",The technology behind preview photos
445,623421554979899217,Git Large File Storage (Git LFS) now in Bitbucket Cloud - Bitbucket,AEM 6.1 Package Manager Metadata Files,Announcing .NET Core 1.0,Client-side ranking to more efficiently show people stories in feed,Test and deploy to Google App Engine with the new Maven and Gradle plugins,Torus
446,-2447632164766022033,O que o GitHub tem a nos dizer sobre os estereótipos entre programadores | Tecnoblog,Migrating from Parse to Bluemix,Introducing New Relic Infrastructure,"What's new in Android: the N-Release, Virtual Reality, Android Studio 2.2 and more | Android Developers Blog",The moment when you realize every server in the world is vulnerable - Free Code Camp,Decentralizing IoT networks through blockchain
447,8224860111193157980,Psicóloga de Harvard diz que as pessoas julgam você em segundos por esses critérios | Jornal do Empreendedor,Investimentos em coaching e mentoring aumentam nas empresas,Como resolver conflitos no ambiente corporativo us,O valor de seu trabalho de coaching vai depender de suas habilidades de acompanhamento - Harvard Business Review Brasil,Cinco competências comportamentais para você ser um bom líder,How to augment your career with leadership coaching
448,-5848514031542611523,Promoting gender equality through emoji �� ��,"O meme 'Luiza, você está atenta?' explicou da melhor forma o machismo na área da tecnologia",#iLookLikeAnEngineer: One Year Later,A importância dos filmes de mulherzinha - Capitolina,Criadas para casar,Empresa britânica adota licença remunerada no período menstrual
449,4105873627900556540,Sua comunidade de Teste.,ITA está oferecendo 10 cursos gratuitos a distância - Engenharia é:,Como o layout de aplicativos influencia o usuário e por que você deveria testá-lo - One Day Testing Blog,"Espresso Intents: não é magia, é tecnologia! - Android Dev BR",BDD Best Practices and Guidelines - Testing Excellence,Top 5 Android Testing Frameworks with Examples
450,-986027724303592548,Neural networks are inadvertently learning our language's hidden gender biases,Workplace diversity in Brazil: there's still a long way to go,"Para rebater Estatuto da Família, campanha muda significado de 'família' no Dicionário Houaiss",Glamour Exclusive: President Obama On Feminism and The World He Wants to Leave His Daughters,The Genderbread Person v3 | It's Pronounced Metrosexual,YouTube chama seus criadores de conteúdo para a campanha mundial #OrgulhoDeSer
451,-3780822597455574960,Top Programming Languages Trends: The Rise of Big Data,Gartner Reprint,Test and deploy to Google App Engine with the new Maven and Gradle plugins,Supercharge Java Auth with JSON Web Tokens (JWTs) | Baeldung,Prisma for Android is now live for all in the Google Play Store,Assessing Salesforce's platform and ecosystem | ZDNet
452,-8208801367848627943,Ray Kurzweil: The world isn't getting worse - our information is getting better,So you want to sell to banks?,Time to Re-Think Design Thinking,How to Get a Job at Google,Introducing New Relic Infrastructure,Jeff Seguros: SEGUROS E GAMES
453,-360529647164834348,Código Limpo - Está na hora de deixar o GDD (Gambiarra Driven Development) para trás!,Itaú segue tendência das fintechs e se torna primeiro banco tradicional a permitir abertura de contas por app - Startupi,The End Of Apple Man,Firebase Test Lab for Android,How to Design a Walkthrough That Users Will Read,Creating Your Code Review Checklist - DaedTech
454,8749720044741011597,Como Usar o Git e o GitHub,BDD Best Practices and Guidelines - Testing Excellence,Agile: Falta competência nos testes,Sua comunidade de Teste.,ITA está oferecendo 10 cursos gratuitos a distância - Engenharia é:,Testes unitários vs aceitação - Android Dev BR
455,1005751836898964351,Seria Stranger Things uma obra de arte do algoritmo da Netflix?,The AI business landscape,How Mark Zuckerberg Led Facebook's War to Crush Google Plus,Why Google App Engine rocks: A Google engineer's take,"Amazon open-sources its own deep learning software, DSSTNE",What the Google I/O schedule tells us about the future of Android
456,-559964548932224920,Jeff Seguros: SEGUROS E GAMES,Porto Seguro compra carteira de seguros Auto da Chubb,Transforming life insurance with design thinking,The Biggest Crowdfunding Project Ever Was Supposed to Create Manager-free Companies. But It's a Mess,Mobile marketing statistics 2016,An operating model for company-wide agile development
457,-8018192200278263695,Pão de Açúcar tem rombo de R$ 512 milhões com fraude em e-commerce,Startups matam. E suas vítimas são as empresas que ainda não entendem o que é a Economia do Acesso,Visual Thinking and Learning 3.0 working together at Walmart.com | Happy Melly,"Como o e-commerce brasileiro pode, enfim, começar a lucrar",Não existe frete grátis!,Microservices testing
458,1881534532776527237,9 Non-Threatening Leadership Strategies for Women,Google employees are adding 'Lady' to their job titles to fight sexism,"An independent organization just ranked Google as the best cloud, beating Amazon",A minha viagem à Maternidade #tetodomundo,Glamour Exclusive: President Obama On Feminism and The World He Wants to Leave His Daughters,Jury finds Google's implementation of Java in Android was fair use
459,2156244701966673186,"TRF mantém resolução que proíbe ""cura gay"" - Jornal Opção",YouTube chama seus criadores de conteúdo para a campanha mundial #OrgulhoDeSer,"Para rebater Estatuto da Família, campanha muda significado de 'família' no Dicionário Houaiss",The Genderbread Person v3 | It's Pronounced Metrosexual,Netflix emociona com vídeo destacando personagens LGBT,Workplace diversity in Brazil: there's still a long way to go
460,6519443272707698315,Two Different Sales Motions . . . .,Diane Greene wants to put the enterprise front and center of Google Cloud strategy,7 Questions to Ask Before Your Next Digital Transformation,2 terrific #MarTech talks on the rise of AI in marketing - Chief Marketing Technologist,The return of the machinery question,An operating model for company-wide agile development
461,980458131533897249,Elasticsearch: CSV exporter for Kibana Discover,Globo G1 lança Bot para o Telegram que te ajuda a estudar para o Enem,"Vale reverte prejuízo e tem lucro de R$ 1,8 bilhão no 3º trimestre",Cordova iOS Performance Improvements: Drop-in Speed with WKWebView,Usando o git add interativo,Apenas US$ 59: Nintendo anuncia o relançamento do Nintendinho com 30 jogos na memória
462,-1111518890369033396,The Business Case for Progressive Web Apps,Effective learning through code workshops | Box Blog,You don't talk about refactoring club,19 Tips For Everyday Git Use,"HoloLens, da Microsoft, engana o usuário para consertar conexões falhas do cérebro",Promises | Web Fundamentals - Google Developers
463,1436883058900979473,The future of the shopping mall,Visa e Swatch lançam relógio para pagamentos contactless no Brasil - Startupi,MOBILE TIME - Shoppings do Rio testarão solução de marketing com beacons,6 exemplos de como usar computação cognitiva | EXAME.com,Quando usar paginação e quando usar scroll infinito?,Shopping app Spring's redesign could be a game-changer
464,-7564569805639737618,Programação Reativa Funcional com RxJava,"Incrível, Skype se lembrou que o Linux existe!",StrictMode for Runtime Analysis on Android - Google Developers,"Fresco, sim! - Android Dev BR",Android Mobile Vision restores operation and adds Text API | Android Developers Blog,Android Developers Summer Reading List
465,2581138407738454418,10 Modern Software Over-Engineering Mistakes,"What do you mean by ""Event-Driven""?",The Broken Window Theory,Beyond Progressive Web Apps Part 2: We Need to Know What's New,Cloud Native Part 1: Definition,Google's Cloud Dataflow stomps on Apache Spark in new benchmark tests
466,2708089973817733462,You don't talk about refactoring club,The Business Case for Progressive Web Apps,Effective learning through code workshops | Box Blog,What Color is Your Function?,Building Flipkart Lite: A Progressive Web App,Anti-If: The missing patterns
467,8215778202715904841,How to Create an Exponential Mindset,The economic essentials of digital strategy,This startup uses machine learning and satellite imagery to predict crop yields,PwC faz virada digital e já fatura US$ 1 bilhão no mundo,Especial Agrishow: Soluções de agricultura de precisão elevam produtividade e aumentam a qualidade do plantio,The new tech talent you need to succeed in digital
468,5293701842202310496,Can Accenture Take Over Advertising?,Meio&Mensagem,Two Different Sales Motions . . . .,Accenture amplia atuação no Brasil,The need to lead in data and analytics,7 Questions to Ask Before Your Next Digital Transformation
469,-3102652803014865472,Conselho da SABMiller aceita proposta de compra da AB InBev,Startups apostam em aplicativos que conectam fretes e caminhoneiros,Ultrapar aprova investimento adicional de R$ 196 milhões para a Ipiranga,Top Asset Tracking Software: The 52 Best Tools and Software Solutions to Track Your Company's Vital Physical Assets,"Vale reverte prejuízo e tem lucro de R$ 1,8 bilhão no 3º trimestre",Meet the new Brazilian consumer
470,4151147085496712967,Kubernetes,Eclipse Foundation Releases Neon,Serverless Data Sync in Web Apps with Bit Torrent,Pull request first - Practical Blend,"Secret's founder returns with Bold, a Medium for enterprise",Watch Google's AI master the infamously difficult Atari game Montezuma's Revenge
471,-908052164352446106,IoT a favor do relacionamento médico-paciente,Como testar exceções em Java com o JUnit - Code a Test,Micro Profile JavaEE com Wildfly Swarm,Using behavioral data to improve customer satisfaction,Powering a more connected and collaborative enterprise,"Build your own scalable, location analysis platform with Google Cloud Platform and Maps APIs"
472,8912004903894879756,"HoloLens, da Microsoft, engana o usuário para consertar conexões falhas do cérebro",Acesse a versão Material Design do YouTube | Google Discovery,How I sped up the initial render of my Polymer app by 86%,Aplicação de visão computacional com OpenCV,WebAssembly Browser Preview,DualShock 4 Repair
473,7087600436874507849,Workshop de Design Thinking - Unicamp,Most Interesting APIs in 2016: Cognitive Computing,Banco desafia empreendedores e estudantes de tecnologia a buscarem inovação para processos | EXAME.com,"Docker - Build, Ship, and Run Any App, Anywhere",Zuckerberg mostra em vídeo do que sua inteligência artificial 'Jarvis' é capaz,Visa lança desafio para startups de tecnologia - Startupi
474,3170775058142440102,Criadas para casar,Pabllo Vittar reina no novo comercial da Skol para os Jogos Olímpicos,O homofóbico dentro de cada um,O chefe é gay. E daí?,#iLookLikeAnEngineer: One Year Later,A importância dos filmes de mulherzinha - Capitolina
475,-2740396993975951758,SOA com microserviços - Sensedia,Microservices: Real Architectural Patterns,Top 10 Insurtech Trends for 2017 - Insurance Thought Leadership,Mastercard lança plataforma de APIs abertas para soluções de pagamentos - Startupi,Bringing easy and fast checkout with Payment Request API | Web Updates - Google Developers,Building Spring Cloud Microservices That Strangle Legacy Systems
476,-8512461968928613053,Bringing easy and fast checkout with Payment Request API | Web Updates - Google Developers,The Death of Drupal Commerce as an Ecommerce Solution - Third & Grove,SOA com microserviços - Sensedia,"Salesforce buys Demandware for $2.8B, taking a big step into e-commerce",Who sponsors Drupal development? | Dries Buytaert,Google is quietly recording everything you say. Here's how to hear it
477,400125073514833994,Glamour Exclusive: President Obama On Feminism and The World He Wants to Leave His Daughters,Workplace diversity in Brazil: there's still a long way to go,As expectativas das mulheres da Geração Y são muitas,A minha viagem à Maternidade #tetodomundo,Conheça 20 atletas LGBT que vão competir nas Olimpíadas do Rio,Neural networks are inadvertently learning our language's hidden gender biases
478,-8243488279185272615,"Elopar lança o ""Digio"", cartão para brigar com Nubank",Visa lança desafio para startups de tecnologia - Startupi,Bradesco vai lançar novo banco digital: o Next.,Itaú é pioneiro do blockchain,Goodbye accountants! Startup builds AI to automate all your accounting,Nubank pode fechar as portas se BC confirmar mudança amanhã
479,-5065077552540450930,Ranking das maiores seguradoras da Europa - 2015 | Sonho Seguro,Porto Seguro compra carteira de seguros Auto da Chubb,The new tech talent you need to succeed in digital,Transforming life insurance with design thinking,LPIC-OT DevOps Engineer | Linux Professional Institute,Liberty vai adotar telemetria e baratear seguro para bons motoristas
480,6643427232964983922,#iLookLikeAnEngineer: One Year Later,Promoting gender equality through emoji �� ��,Pabllo Vittar reina no novo comercial da Skol para os Jogos Olímpicos,"O meme 'Luiza, você está atenta?' explicou da melhor forma o machismo na área da tecnologia",Criadas para casar,Empresa britânica adota licença remunerada no período menstrual
481,-6156751702010469220,The Broken Window Theory,Advanced Android Espresso,My favorite people and resources to learn Android programming from,Firebase Test Lab for Android,The Importance of Code Reviews,StrictMode for Runtime Analysis on Android - Google Developers
482,-6273159470243757969,This startup uses machine learning and satellite imagery to predict crop yields,"Build your own scalable, location analysis platform with Google Cloud Platform and Maps APIs","How to forecast demand with Google BigQuery, public datasets and TensorFlow | Google Cloud Big Data and Machine Learning Blog",Google Cloud Goes to the Farm,Google acquires deep search engine Kifi to enhance its Spaces group chat app,How to Create an Exponential Mindset
483,-8950763842769120954,Mobify report reveals impact of mobile website speed,Things you probably didn't know you could do with Chrome's Developer Console,Four Node.js Gotchas that Operations Teams Should Know about - The New Stack,"Why Performance Matters, Part 1: The Perception Of Time - Smashing Magazine",Mercado de Cosméticos no Brasil - Setor que não conhece crise!,"Don't Start Big, Start a Little Snowball"
484,6615662748793536194,Especial: O papel dos grandes provedores de TI na Rio 2016,Introducing JIRA Software for iPhone,"No Brasil, '25% dos celulares ainda são 'Burrofones'",Governo brasileiro cria manual para contratação de cloud,Organizing for digital acceleration: Making a two-speed IT operating model work,Assessing Salesforce's platform and ecosystem | ZDNet
485,-2554512494756911972,How enterprise architects can help ensure success with digital transformations,Nintendo has doubled in value since Pokémon Go's release,The Internet of Things is looking for its VisiCalc,Blaise Agüera y Arcas: How computers are learning to be creative,Power to the People: How One Unknown Group of Researchers Holds the Key to Using AI to Solve Real...,Machine Learning Is Redefining The Enterprise In 2016
486,7526364197140419661,Digital Health Coaching,Power to the People: How One Unknown Group of Researchers Holds the Key to Using AI to Solve Real...,The Internet of Things is looking for its VisiCalc,The barbell effect of machine learning.,A step-by-step guide to agile growth experiments,What Science Tells Us About Leadership Potential
